"Ростовская обл, г Зерноград",347740,Россия,Южный,обл,Ростовская,Зерноград,UTC+3,46.8495958,40.312837
"Ростовская обл, г Каменск-Шахтинский",347800,Россия,Южный,обл,Ростовская,Каменск-Шахтинский,UTC+3,48.3205326,40.2689583
"Ростовская обл, г Константиновск",347250,Россия,Южный,обл,Ростовская,Константиновск,UTC+3,47.5773717,41.0967445
"Ростовская обл, г Красный Сулин",346350,Россия,Южный,обл,Ростовская,Красный Сулин,UTC+3,47.8831311,40.0781298
"Ростовская обл, г Миллерово",346130,Россия,Южный,обл,Ростовская,Миллерово,UTC+3,48.9260077,40.3984087
"Ростовская обл, г Морозовск",347210,Россия,Южный,обл,Ростовская,Морозовск,UTC+3,48.3511807,41.8309225
"Ростовская обл, г Новочеркасск",346400,Россия,Южный,обл,Ростовская,Новочеркасск,UTC+3,47.411919,40.1042098
"Ростовская обл, г Новошахтинск",346900,Россия,Южный,обл,Ростовская,Новошахтинск,UTC+3,47.757773,39.9363697
"Ростовская обл, г Пролетарск",347540,Россия,Южный,обл,Ростовская,Пролетарск,UTC+3,46.7038963,41.727594
г Ростов-на-Дону,344000,Россия,Южный,обл,Ростовская,Ростов-на-Дону,UTC+3,47.2224566,39.718803
"Ростовская обл, г Сальск",347630,Россия,Южный,обл,Ростовская,Сальск,UTC+3,46.4752095,41.5410415
"Ростовская обл, г Семикаракорск",346630,Россия,Южный,обл,Ростовская,Семикаракорск,UTC+3,47.5177337,40.8114167
"Ростовская обл, г Таганрог",347900,Россия,Южный,обл,Ростовская,Таганрог,UTC+3,47.2094917,38.9350989
"Ростовская обл, г Цимлянск",347320,Россия,Южный,обл,Ростовская,Цимлянск,UTC+3,47.6477448,42.0931505
"Ростовская обл, г Шахты",346500,Россия,Южный,обл,Ростовская,Шахты,UTC+3,47.7085287,40.2159846
"Рязанская обл, г Касимов",391300,Россия,Центральный,обл,Рязанская,Касимов,UTC+3,54.9373475,41.3913211
"Рязанская обл, г Кораблино",391200,Россия,Центральный,обл,Рязанская,Кораблино,UTC+3,53.9246659,40.0227745
"Рязанская обл, г Михайлов",391710,Россия,Центральный,обл,Рязанская,Михайлов,UTC+3,54.2297402,39.0091481
"Рязанская обл, Пронский р-н, г Новомичуринск",391160,Россия,Центральный,обл,Рязанская,Новомичуринск,UTC+3,54.0376572,39.74654
"Рязанская обл, г Рыбное",391110,Россия,Центральный,обл,Рязанская,Рыбное,UTC+3,54.7256164,39.5134398
"Рязанская обл, г Ряжск",391960,Россия,Центральный,обл,Рязанская,Ряжск,UTC+3,53.7067584,40.0522274
г Рязань,390000,Россия,Центральный,обл,Рязанская,Рязань,UTC+3,54.6254445,39.7358609
"Рязанская обл, г Сасово",391430,Россия,Центральный,обл,Рязанская,Сасово,UTC+3,54.3508885,41.9117422
"Рязанская обл, г Скопин",391800,Россия,Центральный,обл,Рязанская,Скопин,UTC+3,53.823543,39.5492421
"Рязанская обл, г Спас-Клепики",391030,Россия,Центральный,обл,Рязанская,Спас-Клепики,UTC+3,55.1291721,40.1745338
"Рязанская обл, г Спасск-Рязанский",391050,Россия,Центральный,обл,Рязанская,Спасск-Рязанский,UTC+3,54.4070719,40.3763426
"Рязанская обл, г Шацк",391550,Россия,Центральный,обл,Рязанская,Шацк,UTC+3,54.0287312,41.7181803
"Самарская обл, г Жигулевск",445350,Россия,Приволжский,обл,Самарская,Жигулевск,UTC+4,53.4011981,49.4945176
"Самарская обл, г Кинель",446430,Россия,Приволжский,обл,Самарская,Кинель,UTC+4,53.2210298,50.6343776
"Самарская обл, г Нефтегорск",446600,Россия,Приволжский,обл,Самарская,Нефтегорск,UTC+4,52.7972914,51.1637392
"Самарская обл, г Новокуйбышевск",446200,Россия,Приволжский,обл,Самарская,Новокуйбышевск,UTC+4,53.0994565,49.9477382
"Самарская обл, г Октябрьск",445240,Россия,Приволжский,обл,Самарская,Октябрьск,UTC+4,53.1640488,48.670762
"Самарская обл, г Отрадный",446300,Россия,Приволжский,обл,Самарская,Отрадный,UTC+4,53.3800848,51.3438605
"Самарская обл, г Похвистнево",446450,Россия,Приволжский,обл,Самарская,Похвистнево,UTC+4,53.6498299,52.1235156
г Самара,443000,Россия,Приволжский,обл,Самарская,Самара,UTC+4,53.1950306,50.1069518
"Самарская обл, г Сызрань",446000,Россия,Приволжский,обл,Самарская,Сызрань,UTC+4,53.1558674,48.4744629
"Самарская обл, г Тольятти",445000,Россия,Приволжский,обл,Самарская,Тольятти,UTC+4,53.5205348,49.3894028
"Самарская обл, г Чапаевск",446100,Россия,Приволжский,обл,Самарская,Чапаевск,UTC+4,52.928961,49.8673269
г Санкт-Петербург,190000,Россия,Северо-Западный,г,Санкт-Петербург,Санкт-Петербург,UTC+3,59.9391313,30.3159004
"Саратовская обл, г Аркадак",412210,Россия,Приволжский,обл,Саратовская,Аркадак,UTC+4,51.938831,43.4999221
"Саратовская обл, г Аткарск",412420,Россия,Приволжский,обл,Саратовская,Аткарск,UTC+4,51.8736062,45.0003247
"Саратовская обл, г Балаково",413840,Россия,Приволжский,обл,Саратовская,Балаково,UTC+4,52.0224231,47.7827765
"Саратовская обл, г Балашов",412300,Россия,Приволжский,обл,Саратовская,Балашов,UTC+4,51.5388697,43.1839757
"Саратовская обл, г Вольск",412900,Россия,Приволжский,обл,Саратовская,Вольск,UTC+4,52.0459865,47.3873595
"Саратовская обл, г Ершов",413500,Россия,Приволжский,обл,Саратовская,Ершов,UTC+4,51.3508505,48.2762226
"Саратовская обл, г Калининск",412480,Россия,Приволжский,обл,Саратовская,Калининск,UTC+4,51.4993591,44.4710435
"Саратовская обл, г Красноармейск",412800,Россия,Приволжский,обл,Саратовская,Красноармейск,UTC+4,51.023541,45.695044
"Саратовская обл, г Красный Кут",413230,Россия,Приволжский,обл,Саратовская,Красный Кут,UTC+4,50.9598317,46.9712016
"Саратовская обл, г Маркс",413075,Россия,Приволжский,обл,Саратовская,Маркс,UTC+4,51.7133337,46.7400339
"Саратовская обл, г Новоузенск",413360,Россия,Приволжский,обл,Саратовская,Новоузенск,UTC+4,50.455199,48.1413153
"Саратовская обл, г Петровск",412540,Россия,Приволжский,обл,Саратовская,Петровск,UTC+4,52.3094237,45.3851877
"Саратовская обл, г Пугачев",413720,Россия,Приволжский,обл,Саратовская,Пугачев,UTC+4,52.0159921,48.7972223
"Саратовская обл, г Ртищево",412030,Россия,Приволжский,обл,Саратовская,Ртищево,UTC+4,52.2616271,43.7842248
г Саратов,410000,Россия,Приволжский,обл,Саратовская,Саратов,UTC+4,51.5303047,45.9529348
"Саратовская обл, г Хвалынск",412780,Россия,Приволжский,обл,Саратовская,Хвалынск,UTC+4,52.4951572,48.1045771
"Саратовская обл, г Шиханы",412950,Россия,Приволжский,обл,Саратовская,Шиханы,UTC+4,52.1147391,47.2023118
"Саратовская обл, г Энгельс",413100,Россия,Приволжский,обл,Саратовская,Энгельс,UTC+4,51.4854003,46.126722
"Сахалинская обл, г Александровск-Сахалинский",694420,Россия,Дальневосточный,обл,Сахалинская,Александровск-Сахалинский,UTC+11,50.8974378,142.1578559
"Сахалинская обл, г Анива",694030,Россия,Дальневосточный,обл,Сахалинская,Анива,UTC+11,46.713152,142.5265804
"Сахалинская обл, г Долинск",694051,Россия,Дальневосточный,обл,Сахалинская,Долинск,UTC+11,47.3255783,142.7945071
"Сахалинская обл, г Корсаков",694020,Россия,Дальневосточный,обл,Сахалинская,Корсаков,UTC+11,46.6324545,142.799445
"Сахалинская обл, г Курильск",694530,Россия,Дальневосточный,обл,Сахалинская,Курильск,UTC+11,45.2270954,147.8796323
"Сахалинская обл, г Макаров",694140,Россия,Дальневосточный,обл,Сахалинская,Макаров,UTC+11,48.6236334,142.7803205
"Сахалинская обл, г Невельск",694740,Россия,Дальневосточный,обл,Сахалинская,Невельск,UTC+11,46.6526899,141.8630725
"Сахалинская обл, г Оха",694490,Россия,Дальневосточный,обл,Сахалинская,Оха,UTC+11,53.5867839,142.9412411
"Сахалинская обл, г Поронайск",694240,Россия,Дальневосточный,обл,Сахалинская,Поронайск,UTC+11,49.238866,143.1008333
"Сахалинская обл, г Северо-Курильск",694550,Россия,Дальневосточный,обл,Сахалинская,Северо-Курильск,UTC+11,50.6730577,156.1282211
"Сахалинская обл, г Томари",694820,Россия,Дальневосточный,обл,Сахалинская,Томари,UTC+11,47.7620108,142.0615837
"Сахалинская обл, г Углегорск",694920,Россия,Дальневосточный,обл,Сахалинская,Углегорск,UTC+11,49.0815774,142.0692639
"Сахалинская обл, г Холмск",694620,Россия,Дальневосточный,обл,Сахалинская,Холмск,UTC+11,47.0408423,142.041688
г Южно-Сахалинск,693000,Россия,Дальневосточный,обл,Сахалинская,Южно-Сахалинск,UTC+11,46.9591631,142.737976
"Свердловская обл, г Алапаевск",624600,Россия,Уральский,обл,Свердловская,Алапаевск,UTC+5,57.8475571,61.6693817
"Свердловская обл, Сысертский р-н, г Арамиль",624000,Россия,Уральский,обл,Свердловская,Арамиль,UTC+5,56.694632,60.8343125
"Свердловская обл, г Артемовский",623780,Россия,Уральский,обл,Свердловская,Артемовский,UTC+5,57.3384177,61.8947443
"Свердловская обл, г Асбест",624260,Россия,Уральский,обл,Свердловская,Асбест,UTC+5,57.0052277,61.4581156
"Свердловская обл, г Березовский",623700,Россия,Уральский,обл,Свердловская,Березовский,UTC+5,56.9095924,60.8180907
"Свердловская обл, Богдановичский р-н, г Богданович",623530,Россия,Уральский,обл,Свердловская,Богданович,UTC+5,56.7764795,62.0463679
"Свердловская обл, г Верхний Тагил",624160,Россия,Уральский,обл,Свердловская,Верхний Тагил,UTC+5,57.3763758,59.9517653
"Свердловская обл, г Верхняя Пышма",624090,Россия,Уральский,обл,Свердловская,Верхняя Пышма,UTC+5,56.9758903,60.5650383
"Свердловская обл, г Верхняя Салда",624760,Россия,Уральский,обл,Свердловская,Верхняя Салда,UTC+5,58.0465803,60.5560164
"Свердловская обл, г Верхняя Тура",624320,Россия,Уральский,обл,Свердловская,Верхняя Тура,UTC+5,58.3643685,59.8265235
"Свердловская обл, г Верхотурье",624380,Россия,Уральский,обл,Свердловская,Верхотурье,UTC+5,58.8622073,60.8103945
"Свердловская обл, г Волчанск",624940,Россия,Уральский,обл,Свердловская,Волчанск,UTC+5,59.9351707,60.0798618
"Свердловская обл, г Дегтярск",623270,Россия,Уральский,обл,Свердловская,Дегтярск,UTC+5,56.7048206,60.079138
г Екатеринбург,620000,Россия,Уральский,обл,Свердловская,Екатеринбург,UTC+5,56.8385216,60.6054911
"Свердловская обл, г Заречный",624250,Россия,Уральский,обл,Свердловская,Заречный,UTC+5,56.8102931,61.3380029
"Свердловская обл, г Ивдель",624590,Россия,Уральский,обл,Свердловская,Ивдель,UTC+5,60.6944496,60.4245069
"Свердловская обл, г Ирбит",623850,Россия,Уральский,обл,Свердловская,Ирбит,UTC+5,57.6838362,63.057675
"Свердловская обл, г Каменск-Уральский",623400,Россия,Уральский,обл,Свердловская,Каменск-Уральский,UTC+5,56.414962,61.9188674
"Свердловская обл, г Камышлов",624860,Россия,Уральский,обл,Свердловская,Камышлов,UTC+5,56.8465034,62.7119766
"Свердловская обл, г Карпинск",624930,Россия,Уральский,обл,Свердловская,Карпинск,UTC+5,59.7665925,60.0011703
"Свердловская обл, г Качканар",624350,Россия,Уральский,обл,Свердловская,Качканар,UTC+5,58.7051762,59.4839155
"Свердловская обл, г Кировград",624140,Россия,Уральский,обл,Свердловская,Кировград,UTC+5,57.4299433,60.0624051
"Свердловская обл, г Краснотурьинск",624440,Россия,Уральский,обл,Свердловская,Краснотурьинск,UTC+5,59.7636635,60.1934525
"Свердловская обл, г Красноуральск",624330,Россия,Уральский,обл,Свердловская,Красноуральск,UTC+5,58.348651,60.0408764
"Свердловская обл, г Красноуфимск",623300,Россия,Уральский,обл,Свердловская,Красноуфимск,UTC+5,56.612387,57.7636637
"Свердловская обл, г Кушва",624300,Россия,Уральский,обл,Свердловская,Кушва,UTC+5,58.2826013,59.7645766
"Свердловская обл, г Лесной",624200,Россия,Уральский,обл,Свердловская,Лесной,UTC+5,58.6348516,59.7981565
"Свердловская обл, Нижнесергинский р-н, г Михайловск",623080,Россия,Уральский,обл,Свердловская,Михайловск,UTC+5,56.4370039,59.1137316
"Свердловская обл, г Невьянск",624191,Россия,Уральский,обл,Свердловская,Невьянск,UTC+5,57.49131,60.2183429
"Свердловская обл, г Нижние Серги",623090,Россия,Уральский,обл,Свердловская,Нижние Серги,UTC+5,56.6544959,59.2953035
"Свердловская обл, г Нижний Тагил",622000,Россия,Уральский,обл,Свердловская,Нижний Тагил,UTC+5,57.910126,59.9812853
"Свердловская обл, г Нижняя Салда",624740,Россия,Уральский,обл,Свердловская,Нижняя Салда,UTC+5,58.0748272,60.7025418
"Свердловская обл, г Нижняя Тура",624220,Россия,Уральский,обл,Свердловская,Нижняя Тура,UTC+5,58.6309267,59.8520344
"Свердловская обл, г Новая Ляля",624400,Россия,Уральский,обл,Свердловская,Новая Ляля,UTC+5,59.0538977,60.5944825
"Свердловская обл, г Новоуральск",624130,Россия,Уральский,обл,Свердловская,Новоуральск,UTC+5,57.2472567,60.0956714
"Свердловская обл, г Первоуральск",623100,Россия,Уральский,обл,Свердловская,Первоуральск,UTC+5,56.9080085,59.942926
"Свердловская обл, г Полевской",623382,Россия,Уральский,обл,Свердловская,Полевской,UTC+5,56.4956952,60.2365298
"Свердловская обл, г Ревда",623280,Россия,Уральский,обл,Свердловская,Ревда,UTC+5,56.7986319,59.9071591
"Свердловская обл, г Реж",623750,Россия,Уральский,обл,Свердловская,Реж,UTC+5,57.3717477,61.3833842
"Свердловская обл, г Североуральск",624480,Россия,Уральский,обл,Свердловская,Североуральск,UTC+5,60.1533109,59.9525245
"Свердловская обл, г Серов",624981,Россия,Уральский,обл,Свердловская,Серов,UTC+5,59.6047724,60.5753882
"Свердловская обл, г Среднеуральск",624070,Россия,Уральский,обл,Свердловская,Среднеуральск,UTC+5,56.9918901,60.4771018
"Свердловская обл, Сухоложский р-н, г Сухой Лог",624800,Россия,Уральский,обл,Свердловская,Сухой Лог,UTC+5,56.9076193,62.0358093
"Свердловская обл, г Сысерть",624021,Россия,Уральский,обл,Свердловская,Сысерть,UTC+5,56.5005715,60.8190003
"Свердловская обл, г Тавда",623950,Россия,Уральский,обл,Свердловская,Тавда,UTC+5,58.0434672,65.274217
"Свердловская обл, г Талица",623640,Россия,Уральский,обл,Свердловская,Талица,UTC+5,57.0122687,63.7320757
"Свердловская обл, г Туринск",623900,Россия,Уральский,обл,Свердловская,Туринск,UTC+5,58.0393524,63.6981973
г Севастополь,299001,Россия,Южный,г,Севастополь,Севастополь,UTC+3,44.6167013,33.525355
"Респ Северная Осетия - Алания, г Алагир",363240,Россия,Северо-Кавказский,Респ,Северная Осетия - Алания,Алагир,UTC+3,43.0417684,44.2199715
"Респ Северная Осетия - Алания, г Ардон",363331,Россия,Северо-Кавказский,Респ,Северная Осетия - Алания,Ардон,UTC+3,43.1755152,44.2955775
"Респ Северная Осетия - Алания, г Беслан",363020,Россия,Северо-Кавказский,Респ,Северная Осетия - Алания,Беслан,UTC+3,43.1937529,44.5338707
г Владикавказ,362000,Россия,Северо-Кавказский,Респ,Северная Осетия - Алания,Владикавказ,UTC+3,43.020588,44.6819182
"Респ Северная Осетия - Алания, г Дигора",363410,Россия,Северо-Кавказский,Респ,Северная Осетия - Алания,Дигора,UTC+3,43.1567628,44.1549483
"Респ Северная Осетия - Алания, г Моздок",363750,Россия,Северо-Кавказский,Респ,Северная Осетия - Алания,Моздок,UTC+3,43.7471342,44.6569607
"Смоленская обл, г Велиж",216290,Россия,Центральный,обл,Смоленская,Велиж,UTC+3,55.6057916,31.1856206
"Смоленская обл, г Вязьма",215110,Россия,Центральный,обл,Смоленская,Вязьма,UTC+3,55.2116983,34.2951663
"Смоленская обл, г Гагарин",215010,Россия,Центральный,обл,Смоленская,Гагарин,UTC+3,55.5525228,34.9950502
"Смоленская обл, г Демидов",216240,Россия,Центральный,обл,Смоленская,Демидов,UTC+3,55.2682105,31.5062809
"Смоленская обл, г Десногорск",216400,Россия,Центральный,обл,Смоленская,Десногорск,UTC+3,54.146457,33.2833222
"Смоленская обл, г Дорогобуж",215710,Россия,Центральный,обл,Смоленская,Дорогобуж,UTC+3,54.9136959,33.3023162
"Смоленская обл, г Духовщина",216200,Россия,Центральный,обл,Смоленская,Духовщина,UTC+3,55.1950257,32.401252
"Смоленская обл, г Ельня",216330,Россия,Центральный,обл,Смоленская,Ельня,UTC+3,54.5837795,33.1749867
"Смоленская обл, г Починок",216450,Россия,Центральный,обл,Смоленская,Починок,UTC+3,54.406244,32.4398039
"Смоленская обл, г Рославль",216500,Россия,Центральный,обл,Смоленская,Рославль,UTC+3,53.9449558,32.8480258
"Смоленская обл, г Рудня",216790,Россия,Центральный,обл,Смоленская,Рудня,UTC+3,54.9441093,31.0794806
"Смоленская обл, г Сафоново",215500,Россия,Центральный,обл,Смоленская,Сафоново,UTC+3,55.1199661,33.2336988
г Смоленск,214000,Россия,Центральный,обл,Смоленская,Смоленск,UTC+3,54.7866913,31.8152477
"Смоленская обл, г Сычевка",215279,Россия,Центральный,обл,Смоленская,Сычевка,UTC+3,55.8308821,34.2778793
"Смоленская обл, г Ярцево",215800,Россия,Центральный,обл,Смоленская,Ярцево,UTC+3,55.0564732,32.6902302
"Ставропольский край, г Благодарный",356420,Россия,Северо-Кавказский,край,Ставропольский,Благодарный,UTC+3,45.0989782,43.4306455
"Ставропольский край, г Буденновск",356800,Россия,Северо-Кавказский,край,Ставропольский,Буденновск,UTC+3,44.7816067,44.1650339
"Ставропольский край, г Георгиевск",357820,Россия,Северо-Кавказский,край,Ставропольский,Георгиевск,UTC+3,44.1485694,43.4739851
"Ставропольский край, г Ессентуки",357600,Россия,Северо-Кавказский,край,Ставропольский,Ессентуки,UTC+3,44.0446186,42.8588653
"Ставропольский край, г Железноводск",357400,Россия,Северо-Кавказский,край,Ставропольский,Железноводск,UTC+3,44.1320568,43.0306461
"Ставропольский край, г Зеленокумск",357910,Россия,Северо-Кавказский,край,Ставропольский,Зеленокумск,UTC+3,44.4032668,43.8841877
"Ставропольский край, г Изобильный",356140,Россия,Северо-Кавказский,край,Ставропольский,Изобильный,UTC+3,45.3684296,41.708702
"Ставропольский край, г Ипатово",356630,Россия,Северо-Кавказский,край,Ставропольский,Ипатово,UTC+3,45.7181751,42.8970206
"Ставропольский край, г Кисловодск",357700,Россия,Северо-Кавказский,край,Ставропольский,Кисловодск,UTC+3,43.9052044,42.7168721
